{
  "schema_version": "1.0",
  "run_id": "e7_g5-1a2b3c4-0",
  "gate": "G5",
  "seed": 0,
  "t": 18,
  "proposer": "P1",
  "aggressiveness": 2,
  "group": "P1",
  "x_hash": "0b1c2d3e4f5a6b7c8d9e0f1a2b3c4d5e6f7a8b9c0d1e2f3a4b5c6d7e8f9a0b1c",
  "s": 0.5,
  "r_hot": 0.3,
  "sd_hot": 0.2,
  "q_t": 2.4,
  "B": 1.2,
  "decision": "flag",
  "p_t": 0.1,
  "audited": false,
  "T_lo": null,
  "T_hi": null,
  "S_hi": null,
  "err": null,
  "alpha_t": 0.1,
  "iters_used": 61,
  "oracle_peak": null
}
