{
  "schema_version": "1.0",
  "run_id": "e7_g5-1a2b3c4-0",
  "gate": "G5",
  "seed": 0,
  "t": 17,
  "proposer": "P1",
  "aggressiveness": 2,
  "group": "P1",
  "x_hash": "3f2a9c1e5b7d4f6a8c0e2b4d6f8a1c3e5b7d9f1a3c5e7b9d1f3a5c7e9b1d3f5a",
  "s": 0.35,
  "r_hot": 0.21,
  "sd_hot": 0.14,
  "q_t": 2.4,
  "B": 0.84,
  "decision": "audit",
  "p_t": 0.1,
  "audited": true,
  "T_lo": 73.9,
  "T_hi": 74.6,
  "S_hi": 1.71,
  "err": 0,
  "alpha_t": 0.1,
  "iters_used": 22,
  "oracle_peak": 74.31
}
