{
  "schema_version": "1.0",
  "run_id": "e7_g0-1a2b3c4d5e6f-4",
  "gate": "G0",
  "seed": 4,
  "t": 0,
  "proposer": "P4",
  "aggressiveness": null,
  "group": null,
  "x_hash": "3f2a9c1e5b7d4f6a8c0e2b4d6f8a1c3e5b7d9f1a3c5e7b9d1f3a5c7e9b1d3f5a",
  "s": 0.4,
  "r_hot": 0.25,
  "sd_hot": 0.15,
  "q_t": null,
  "B": null,
  "decision": "accept",
  "p_t": 0.0,
  "audited": false,
  "T_lo": null,
  "T_hi": null,
  "S_hi": null,
  "err": null,
  "alpha_t": null,
  "iters_used": 0,
  "oracle_peak": 66.0
}
